{
  "$schema": "https://json-schema.org/draft/2020-12/schema",
  "$id": "https://schemas.multicloud-network-mcp.dev/schemas/v1/vpn-tunnel.schema.json",
  "$comment": "GENERATED -- do not hand-edit. Produced by scripts/generate_schemas.py from multicloud_network_mcp.contracts.models.VpnTunnel (contract version 1.0.0). Edit the Pydantic model and re-run the script instead.",
  "$defs": {
    "CloudScope": {
      "description": "Where a fact was observed: which provider, which tenancy\nboundary, which geography, and when. Every field beyond ``provider``\nand ``collected_at`` is optional because no single provider\npopulates all of them -- see the field-by-field mapping below and\n``docs/normalization.md``.\n\n- ``tenant_id``: Azure AD tenant. Rarely meaningful for AWS/GCP.\n- ``account_id``: AWS account ID (12 digits).\n- ``subscription_id``: Azure subscription GUID.\n- ``project_id``: GCP project ID.\n- ``resource_group``: Azure resource group -- kept as its own field\n  (not folded into ``extensions``) because Azure resource identity is\n  genuinely incomplete without it, unlike a merely-supplementary fact.\n- ``region``: AWS/GCP-style region (``us-east-1``/``us-central1``).\n- ``location``: Azure's own term for the same granularity (ARM\n  responses literally use the JSON field name ``location``, not\n  ``region``) -- kept as a separate field rather than aliased onto\n  ``region``, since forcing Azure's ``location`` string into a field\n  named ``region`` would misrepresent which provider vocabulary it\n  came from.\n- ``zone``: availability-zone-level granularity, when the provider\n  exposes it (AWS AZ, Azure zone number, GCP zone).\n- ``collected_at``: ISO 8601 UTC timestamp this scope's data was\n  observed at -- never a live/real-time value.",
      "properties": {
        "provider": {
          "$ref": "#/$defs/Provider"
        },
        "tenant_id": {
          "anyOf": [
            {
              "type": "string"
            },
            {
              "type": "null"
            }
          ],
          "default": null,
          "title": "Tenant Id"
        },
        "account_id": {
          "anyOf": [
            {
              "type": "string"
            },
            {
              "type": "null"
            }
          ],
          "default": null,
          "title": "Account Id"
        },
        "subscription_id": {
          "anyOf": [
            {
              "type": "string"
            },
            {
              "type": "null"
            }
          ],
          "default": null,
          "title": "Subscription Id"
        },
        "project_id": {
          "anyOf": [
            {
              "type": "string"
            },
            {
              "type": "null"
            }
          ],
          "default": null,
          "title": "Project Id"
        },
        "resource_group": {
          "anyOf": [
            {
              "type": "string"
            },
            {
              "type": "null"
            }
          ],
          "default": null,
          "title": "Resource Group"
        },
        "region": {
          "anyOf": [
            {
              "type": "string"
            },
            {
              "type": "null"
            }
          ],
          "default": null,
          "title": "Region"
        },
        "location": {
          "anyOf": [
            {
              "type": "string"
            },
            {
              "type": "null"
            }
          ],
          "default": null,
          "title": "Location"
        },
        "zone": {
          "anyOf": [
            {
              "type": "string"
            },
            {
              "type": "null"
            }
          ],
          "default": null,
          "title": "Zone"
        },
        "collected_at": {
          "title": "Collected At",
          "type": "string"
        }
      },
      "required": [
        "provider",
        "collected_at"
      ],
      "title": "CloudScope",
      "type": "object"
    },
    "Provider": {
      "enum": [
        "aws",
        "azure",
        "gcp"
      ],
      "title": "Provider",
      "type": "string"
    }
  },
  "description": "Unifies an AWS ``VpnConnection``'s nested ``VpnTunnel``, an Azure\n``VpnConnection``/``VirtualNetworkGatewayConnection``, and a GCP\n``VpnTunnel``.\n\n``redacted: bool = True`` is a permanent guarantee, not a toggle: no\npre-shared key/shared-secret field exists anywhere on this model, and\nnone of the three source repos this contract unifies ever reads that\nvalue into their own models either.\n\nSemantic gap: ``status`` is this contract's coarse, cross-provider\n``ObservedState`` vocabulary (``up``/``down``/``degraded``/\n``provisioning``/``unknown``); ``native_status`` preserves each\nprovider's actual, much richer status string verbatim (GCP's\n``ESTABLISHED``, Azure's ``Connected``, AWS's ``UP``) since the\n``status`` mapping is lossy by design -- a consumer that needs the\nexact provider semantics reads ``native_status``, not ``status``.",
  "properties": {
    "extensions": {
      "additionalProperties": {
        "additionalProperties": true,
        "type": "object"
      },
      "title": "Extensions",
      "type": "object"
    },
    "urn": {
      "title": "Urn",
      "type": "string"
    },
    "native_id": {
      "title": "Native Id",
      "type": "string"
    },
    "resource_type": {
      "title": "Resource Type",
      "type": "string"
    },
    "provider": {
      "$ref": "#/$defs/Provider"
    },
    "scope": {
      "$ref": "#/$defs/CloudScope"
    },
    "name": {
      "anyOf": [
        {
          "type": "string"
        },
        {
          "type": "null"
        }
      ],
      "default": null,
      "title": "Name"
    },
    "tags": {
      "additionalProperties": {
        "type": "string"
      },
      "title": "Tags",
      "type": "object"
    },
    "observed_at": {
      "title": "Observed At",
      "type": "string"
    },
    "source_api": {
      "anyOf": [
        {
          "type": "string"
        },
        {
          "type": "null"
        }
      ],
      "default": null,
      "title": "Source Api"
    },
    "collection_completeness": {
      "default": "complete",
      "title": "Collection Completeness",
      "type": "string"
    },
    "gateway_urn": {
      "title": "Gateway Urn",
      "type": "string"
    },
    "peer_gateway_urn": {
      "anyOf": [
        {
          "type": "string"
        },
        {
          "type": "null"
        }
      ],
      "default": null,
      "title": "Peer Gateway Urn"
    },
    "peer_ip": {
      "anyOf": [
        {
          "type": "string"
        },
        {
          "type": "null"
        }
      ],
      "default": null,
      "title": "Peer Ip"
    },
    "status": {
      "title": "Status",
      "type": "string"
    },
    "native_status": {
      "anyOf": [
        {
          "type": "string"
        },
        {
          "type": "null"
        }
      ],
      "default": null,
      "title": "Native Status"
    },
    "bgp_enabled": {
      "anyOf": [
        {
          "type": "boolean"
        },
        {
          "type": "null"
        }
      ],
      "default": null,
      "title": "Bgp Enabled"
    },
    "bgp_asn": {
      "anyOf": [
        {
          "type": "integer"
        },
        {
          "type": "null"
        }
      ],
      "default": null,
      "title": "Bgp Asn"
    },
    "redacted": {
      "default": true,
      "title": "Redacted",
      "type": "boolean"
    }
  },
  "required": [
    "urn",
    "native_id",
    "resource_type",
    "provider",
    "scope",
    "observed_at",
    "gateway_urn",
    "status"
  ],
  "title": "VpnTunnel",
  "type": "object"
}
